{
  "schemaVersion": 1,
  "chainId": 421614,
  "contractName": "ParmeliaCrosschainRouter",
  "address": "0xd089c3764a8f2e62efdf280eb2432c1dc647400c",
  "transactionHash": "0xb414f0f33346a1b3a189cf9d8ec0358aa5e3107942f0743b7abd46278efb528e",
  "blockNumber": 301399341,
  "deployer": "0x75464f762bc50d0a0b127ab5a085504bf102bb88",
  "constructorArguments": [
    "0x75464f762bc50d0A0B127ab5a085504BF102Bb88",
    "0x75faf114eafb1BDbe2F0316DF893fd58CE46AA4d",
    "0x8FE6B999Dc680CcFDD5Bf7EB0974218be2542DAA",
    "0x75464f762bc50d0A0B127ab5a085504BF102Bb88",
    "[1, 6]"
  ],
  "runtimeBytecodeHash": "0xce4319f720b2fe509b06598df23af2818d03b5d685119c9397906b03280af6bb",
  "runtimeBytecodeChecks": {
    "latest": true,
    "deploymentBlock": true
  },
  "roles": {
    "owner": "0x75464f762bc50d0a0b127ab5a085504bf102bb88",
    "treasury": "0x75464f762bc50d0a0b127ab5a085504bf102bb88",
    "authorizationSigner": null,
    "pauseGuardian": null,
    "pendingOwner": "0x0000000000000000000000000000000000000000",
    "ownershipAccepted": true
  },
  "compiler": {
    "solc": "0.8.34",
    "viaIr": true,
    "evmVersion": "cancun",
    "optimizer": true,
    "optimizerRuns": 1000000
  },
  "source": {
    "commit": "60e36bfdc4f6afa80a71dcc232129741a49ba7ee",
    "matchesCurrentHead": true,
    "worktreeDirty": true,
    "broadcastFile": "contracts/broadcast/Deploy.s.sol/421614/run-1787546971913.json",
    "verification": {
      "status": "verified",
      "url": "https://sourcify.dev/server/v2/contract/421614/0xD089c3764a8F2E62eFDf280Eb2432c1dC647400c"
    }
  },
  "createdAt": "2026-08-24T04:49:44.404Z"
}
